{
  "$schema": "https://json-schema.org/draft/2020-12/schema",
  "$id": "seller_row.schema.json",
  "title": "Seller row: input to generator.generate.generate_persona()",
  "description": "One flat object per seller. Every field is optional and may be null: missing values fall back to defaults and the affected persona choices are marked low confidence. Unknown extra fields are ignored.",
  "type": "object",
  "properties": {
    "fk_glusr_usr_id": {"type": ["integer", "string", "null"], "description": "Seller id (GLID). Copied into the spec as seller_id."},
    "company": {"type": ["string", "null"], "description": "Company name, used to confirm the business by name."},
    "seller_state": {"type": ["string", "null"], "description": "Indian state, e.g. \"Uttar Pradesh\". Sets the region and the start language."},
    "seller_city": {"type": ["string", "null"]},
    "seller_locality": {"type": ["string", "null"]},
    "annual_turnover": {"type": ["string", "null"], "enum": ["0 - 40 L", "40 L - 1.5 Cr", "1.5 - 5 Cr", "5 - 25 Cr", "25 - 100 Cr", "100 - 500 Cr", "> 500 Cr", "500 Cr & above", null], "description": "Turnover band; 1.5 Cr and above count as mid or large businesses (consultative persona)."},
    "business_type": {"type": ["string", "null"], "examples": ["Proprietorship", "Partnership", "Limited Company", "Others"], "description": "\"Limited Company\" leads to the consultative persona."},
    "nature_of_business": {"type": ["string", "null"], "examples": ["Manufacturer", "Trader - Retailer", "Trader - Wholesaler/Distributor", "Service Provider and Others"]},
    "top_category_1": {"type": ["string", "null"], "description": "Main product category."},
    "top_category_2": {"type": ["string", "null"]},
    "top_category_3": {"type": ["string", "null"]},
    "top_category_group": {"type": ["string", "null"]},
    "gst_registration_year": {"type": ["integer", "number", "null"]},
    "eng_pickup_ratio_1yr": {"type": ["number", "null"], "minimum": 0, "maximum": 100, "description": "Percent of IndiaMART calls picked up in the last year. Over 50 means an engaged seller."},
    "eng_enq_received_90d": {"type": ["number", "null"], "minimum": 0, "description": "Buyer enquiries received in the last 90 days."},
    "eng_enq_replies_90d": {"type": ["number", "null"], "minimum": 0, "description": "Enquiries replied to in the last 90 days; 3 or more means an engaged seller."},
    "eng_cqs": {"type": ["number", "null"], "minimum": 0, "maximum": 100, "description": "Catalog quality score."},
    "eng_product_count": {"type": ["number", "null"], "minimum": 0},
    "bot_answered": {"type": ["integer", "null"], "minimum": 0, "description": "Past VANI bot calls answered."},
    "bot_attempts": {"type": ["integer", "null"], "minimum": 0, "description": "Past VANI bot calls attempted."},
    "avg_answered_call_sec": {"type": ["number", "null"], "minimum": 0, "description": "Average length of answered calls; under 12 s means a fast hang-up seller (brisk persona)."},
    "calls_meeting_fixed": {"type": ["integer", "number", "null"], "minimum": 0},
    "calls_not_interested": {"type": ["integer", "number", "null"], "minimum": 0},
    "calls_call_later": {"type": ["integer", "number", "null"], "minimum": 0},
    "ctx_early_calls": {"type": ["integer", "null"], "minimum": 0, "description": "Past answered calls that ended within 10 s (from the call log)."},
    "ctx_last_bucket": {"type": ["string", "null"], "examples": ["PIM", "PAM", "PANF", "PUA", "OLP", "NUR", "SCHD", "ENQR", "PNSR", "PNSM", "UA", "PUT"], "description": "Trigger code of the last call (why IndiaMART called)."},
    "past_dispositions_detailed": {"type": ["string", "null"], "pattern": "^([^;()]+ \\(\\d+\\)(; )?)*$", "examples": ["meeting_fixed (1); not_interested (1)"], "description": "Outcome counts from past calls, 'label (count); label (count)'."},
    "past_objections": {"type": ["string", "null"], "examples": ["Callback / Deferred Engagement (Neutral) (1)"], "description": "Objection counts from past calls, same format."},
    "past_questions_asked": {"type": ["string", "null"], "examples": ["Clarification (1); Location Confirmation (1)"], "description": "Question counts from past calls, same format."},
    "asked_if_talking_to_bot": {"type": ["integer", "boolean", "null"], "description": "1 if the seller asked whether this is a bot on a past call."},
    "showed_frustration": {"type": ["integer", "boolean", "null"], "description": "1 if frustrated on a past call (calm repair persona)."},
    "already_in_touch_with_executive": {"type": ["integer", "boolean", "null"]},
    "do_not_call_requested": {"type": ["integer", "boolean", "null"], "description": "1 if the seller asked not to be called (calm repair persona; the contact gate blocks the call)."}
  },
  "additionalProperties": true
}
