{
  "fk_glusr_usr_id": 1000001,
  "company": "Example LED Traders",
  "seller_state": "Rajasthan",
  "seller_city": "Jaipur",
  "seller_locality": "Malviya Nagar",
  "annual_turnover": "0 - 40 L",
  "business_type": "Proprietorship",
  "nature_of_business": "Trader - Wholesaler/Distributor",
  "top_category_1": "LED Module",
  "top_category_2": "Round LED Light",
  "top_category_3": "LED COB Light",
  "top_category_group": "Lights, Lighting Fixtures and Components",
  "gst_registration_year": 2019,
  "eng_pickup_ratio_1yr": 40,
  "eng_enq_received_90d": 6,
  "eng_enq_replies_90d": 1,
  "eng_cqs": 12,
  "eng_product_count": 18,
  "bot_answered": 7,
  "bot_attempts": 12,
  "avg_answered_call_sec": 21.5,
  "calls_meeting_fixed": 0,
  "calls_not_interested": 0,
  "calls_call_later": 0,
  "ctx_early_calls": 4,
  "ctx_last_bucket": "PIM",
  "past_dispositions_detailed": "call_dropped (2); general (3)",
  "past_objections": null,
  "past_questions_asked": "Clarification (1)",
  "asked_if_talking_to_bot": 0,
  "showed_frustration": 0,
  "already_in_touch_with_executive": 0,
  "do_not_call_requested": 0
}
